{
  "$schema": "http://json-schema.org/draft-07/schema#",
  "title": "IR",
  "description": "The main IR structure representing a keyboard configuration",
  "type": "object",
  "required": [
    "keys"
  ],
  "properties": {
    "conditions": {
      "description": "Named condition definitions",
      "type": "object",
      "additionalProperties": true
    },
    "keys": {
      "description": "Physical key mappings",
      "type": "object",
      "additionalProperties": {
        "$ref": "#/definitions/Key"
      }
    },
    "layers": {
      "description": "Available layers",
      "type": "array",
      "items": {
        "type": "string"
      }
    },
    "macros": {
      "description": "Named macro definitions",
      "type": "object",
      "additionalProperties": true
    },
    "meta": {
      "description": "Optional metadata about the configuration",
      "type": [
        "object",
        "null"
      ],
      "additionalProperties": true
    }
  },
  "definitions": {
    "Action": {
      "description": "An action that can be performed",
      "anyOf": [
        {
          "description": "Simple key output",
          "type": "string"
        },
        {
          "description": "Complex action",
          "allOf": [
            {
              "$ref": "#/definitions/ComplexAction"
            }
          ]
        }
      ]
    },
    "ComplexAction": {
      "description": "Complex action with multiple possible behaviors",
      "type": "object",
      "properties": {
        "layer": {
          "description": "Switch to a layer",
          "type": [
            "string",
            "null"
          ]
        },
        "macro_name": {
          "description": "Execute a macro",
          "type": [
            "string",
            "null"
          ]
        }
      }
    },
    "Key": {
      "description": "Configuration for a physical key",
      "type": "object",
      "required": [
        "tap"
      ],
      "properties": {
        "hold": {
          "description": "Action when key is held",
          "anyOf": [
            {
              "$ref": "#/definitions/Action"
            },
            {
              "type": "null"
            }
          ]
        },
        "macros": {
          "description": "Macros associated with this key",
          "type": "array",
          "items": {
            "type": "string"
          }
        },
        "mods": {
          "description": "Modifier keys that affect this mapping",
          "type": "array",
          "items": {
            "type": "string"
          }
        },
        "tap": {
          "description": "Action when key is tapped",
          "allOf": [
            {
              "$ref": "#/definitions/Action"
            }
          ]
        },
        "when": {
          "description": "Condition that must be met for this mapping",
          "type": [
            "string",
            "null"
          ]
        }
      }
    }
  }
}